{
  "planId": "tp-base-001",
  "mode": "AUTO",
  "status": "ready",
  "entries": [
    {
      "partId": "part-001",
      "contourId": "part-001-inner-1",
      "startPointParam": 0,
      "direction": "CW",
      "leadIn": { "enabled": true, "length": 4, "angleDeg": 45 },
      "leadOut": { "enabled": true, "length": 3, "angleDeg": 30 }
    },
    {
      "partId": "part-001",
      "contourId": "part-001-outer",
      "startPointParam": 0.25,
      "direction": "CCW",
      "leadIn": { "enabled": true, "length": 4, "angleDeg": 45 },
      "leadOut": { "enabled": true, "length": 3, "angleDeg": 30 }
    }
  ],
  "segments": [
    {
      "segmentId": "seg-base-001",
      "kind": "RAPID",
      "sequence": 0,
      "partId": "part-001",
      "contourId": "part-001-inner-1",
      "from": { "x": 0, "y": 0 },
      "to": { "x": 30, "y": 20 },
      "length": 36.0555
    },
    {
      "segmentId": "seg-base-002",
      "kind": "CUT",
      "sequence": 1,
      "partId": "part-001",
      "contourId": "part-001-inner-1",
      "from": { "x": 30, "y": 20 },
      "to": { "x": 90, "y": 20 },
      "length": 60
    },
    {
      "segmentId": "seg-base-003",
      "kind": "RAPID",
      "sequence": 2,
      "partId": "part-001",
      "contourId": "part-001-outer",
      "from": { "x": 30, "y": 20 },
      "to": { "x": 120, "y": 0 },
      "length": 92.1954
    },
    {
      "segmentId": "seg-base-004",
      "kind": "CUT",
      "sequence": 3,
      "partId": "part-001",
      "contourId": "part-001-outer",
      "from": { "x": 120, "y": 0 },
      "to": { "x": 120, "y": 80 },
      "length": 80,
      "preserve": false,
      "commonEdgeGroupId": "ce-base-001"
    }
  ],
  "metrics": {
    "cutLength": 420,
    "rapidLength": 198.2509,
    "pierceCount": 2,
    "estimatedTimeSec": 28.6,
    "thermalPenalty": 1.2
  },
  "check": {
    "valid": true,
    "violations": [],
    "warnings": []
  },
  "warnings": [],
  "appliedOverrides": {
    "startPointOverrides": [],
    "leadOverrides": [],
    "sequenceOverrides": []
  },
  "generatedAt": "2026-02-17T08:00:00Z"
}
